Time,Title,Content,Url
2016/9/30, 歐美遭民粹把持 拉美成樂土！哈森泰博：巴西回正軌 ,富蘭克林坦伯頓全球宏觀團隊投資長、「富坦全球債券基金」(Templeton Global Bond Fund)明星操盤人麥可哈森泰博(Michael Hasenstab，見圖)曾在2月準確抓到巴西股市的底部(見此)，現在他再次發表談話，宣稱巴西、哥倫比亞的經濟已開始回歸正軌，拉丁美洲迎來令人振奮的全新時代。哈森泰博29日在官方Twitter貼出的影片中表示，在當下，歐美民粹主義肆虐、實施的政策更有傷害經濟之虞，拉丁美洲卻走上另一條道路、未來十年蘊含極大的發展潛力。他說，巴西、阿根廷等拉美國家過去遭民粹把持，經濟和社會福利毀於一旦，如今各國吸取教訓、掙脫民粹枷鎖並成立新政府，開始實施較為正統的經濟政策、激發成長潛力，還大幅改善了社福。舉例來說，哥倫比亞終於結束長達15年的內戰，還大舉開放外資入境投資，成長潛力勢必可明顯增溫，未來也有望順利壓抑通膨。除此之外，巴西政權開始更替，把透支國庫、把利率壓得太低導致通膨飆高等錯誤政策完全捨棄，經濟也會逐漸回歸正軌。相較之下，墨西哥經濟一直都很穩定、其實已有好一段時間未曾脫軌過，即使面對美國經濟趨緩、金融市場動盪、全球貿易降溫、原物料價格重挫等外部衝擊，墨西哥經過數十年的經濟建設、加上央行穩定操舵，仍可安然度過打擊。哈森泰博認為，墨西哥經濟仍在穩定成長中，但市場卻不同意、墨西哥披索被打壓至歷史新低附近，比全球金融海嘯、龍舌蘭酒危機(tequila crisis)還要慘，而事實上經濟並沒有這兩個時期這麼糟。他相信，市場真的反應過度，墨西哥披索是全世界最被低估的貨幣之一。美元指數近來走勢平緩，而摩根士丹利(Morgan Stanley，通稱大摩)認為，未來幾個月美元指數應該會再跌4-5%。如此一來，以原物料為重的拉丁美洲，應該能喘一口氣。barron`s.com 9月22日報導，大摩貨幣策略師Hans Redeker發表研究報告指出，Fed的立場足夠偏鴿、又把重點放在接下來的經濟數據，有鑑於數據可能令人失望，再加上日銀最新政策框架恐難扭轉日圓近來的上升趨勢，估計美元會續貶。Redeker還說，以技術線型來看，FED貿易加權美元指數並未突破7月的前波高，這是技術線型中一個重要警訊，因此大摩預估，美元指數接下來可能會進一步下滑4-5%。大摩對利息較高的新興貨幣依舊樂觀看待，這當中包括巴西里爾、俄羅斯盧布和印尼盾，紐幣、澳幣也獲大摩青睞，因其利息高於美元。素有「新興市場教父」之稱的富蘭克林坦伯頓新興市場研究團隊總裁馬克墨比爾斯(Mark Mobius)則認為，美國利率僅會小幅上揚，新興市場應該輕鬆應付。墨比爾斯9月21日在Fed發布聲明後，立即在官網貼文表示，美國利率只會小幅且緩步上揚，新興市場應該能夠自行解決衝擊。值得注意的是，利率攀高不代表股市就會下跌，過去許多例子都證明，即使利率持續上揚、新興股市仍可持續往上漲。墨比爾斯還說，雖然新興市場對總經指標和全球貨幣政策仍舊敏感，意味著市場可能會持續震盪一段時間，但投資人對新興市場的信心已開始恢復。＊編者按：本文僅供參考之用，並不構成要約、招攬或邀請、誘使、任何不論種類或形式之申述或訂立任何建議及推薦，讀者務請運用個人獨立思考能力，自行作出投資決定，如因相關建議招致損失，概與《精實財經媒體》、編者及作者無涉。MoneyDJ 新聞 2016-09-30 15:01:35 記者郭妍希 報導,https://blog.moneydj.com/news/2016/09/30/%e6%ad%90%e7%be%8e%e9%81%ad%e6%b0%91%e7%b2%b9%e6%8a%8a%e6%8c%81-%e6%8b%89%e7%be%8e%e6%88%90%e6%a8%82%e5%9c%9f%ef%bc%81%e5%93%88%e6%a3%ae%e6%b3%b0%e5%8d%9a%ef%bc%9a%e5%b7%b4%e8%a5%bf%e5%9b%9e%e6%ad%a3/
2016/9/26, 巴西與秘魯領軍 拉丁美洲礦業生產出現復甦 ,"《MINING.com》9月23日報導，惠譽信評旗下研究機構BMI Research報告表示，在經歷將近兩年因商品價格的持續下跌而導致的經濟困頓之後，拉丁美洲的礦業生產部門正出現復甦的跡象；不過，領軍的並不是傳統的礦業大國智利，巴西與秘魯反而吸引了更多的投資，分別是因為其國內高品質的鐵礦石以及銅礦資源，儘管兩國的政治與經營環境仍存有一些風險。智利則仍可望站穩最大銅產國的位置，預估至2020年，該國銅的年產量將再增加34.6萬噸。 英國投行Liberum Capital報告稱，鐵礦石龍頭巴西淡水河谷（Vale）未來12個月將再增加約5,000萬噸的供給量，此將會令已經供給過剩的鐵礦石市場雪上加霜，也將打壓鐵礦石的價格。而澳洲的兩大巨頭力拓（Rio Tinto）與必和必拓（BHP Billiton），2017上半年的鐵礦石供應量合計將達6.86億噸，相比今年上半年與下半年的供應量分別為6.363億噸與6.778億噸。淡水河谷預計2017年鐵礦石價格可以維持在每噸50美元以上價位，但Citigroup則預估明年鐵礦石均價將為每噸45美元。 國際銅研究組織（International Copper Study Group, ICSG）月報表示，今年上半年，全球銅礦產量年增4.5%或430,000噸至982.1萬噸，主要受到秘魯產量年增50%的帶動，美國、加拿大、墨西哥與蒙古的銅產量也都出現增長；不過，最大銅礦產國智利的產量則是年減5.5%，剛果民主共和國的銅礦產量也年減10%。全球銅礦產能利用率較上年同期持平為84.5%。秘魯能源及礦產部表示，受到新項目投產的帶動，秘魯今年可望成為第二大的銅產國。 中國大陸國土資源部部長姜大明9月23日表示，中國已經成為世界上最大礦產品生產國、消費國和貿易國。姜大明表示，在過去五年中，中國地質找礦取得重要成果，地質勘查投入累計達人民幣5682億元，新發現大中型礦產地730多處，新增一批億噸級油田和千億方級氣田；國內礦產資源供應能力穩步提高，一次能源總產量117億噸標準煤、鐵礦石總產量68億噸、10種有色金屬總產量2億噸。礦產對外貿易持續發展，礦產品進出口貿易總額近5兆美元，增長81%。 ＊編者按：本文僅供參考之用，並不構成要約、招攬或邀請、誘使、任何不論種類或形式之申述或訂立任何建議及推薦，讀者務請運用個人獨立思考能力，自行作出投資決定，如因相關建議招致損失，概與《精實財經媒體》、編者及作者無涉。MoneyDJ 新聞 2016-09-26 11:26:41 記者黃文章 報導",https://blog.moneydj.com/news/2016/09/26/%e5%b7%b4%e8%a5%bf%e8%88%87%e7%a7%98%e9%ad%af%e9%a0%98%e8%bb%8d-%e6%8b%89%e4%b8%81%e7%be%8e%e6%b4%b2%e7%a4%a6%e6%a5%ad%e7%94%9f%e7%94%a2%e5%87%ba%e7%8f%be%e5%be%a9%e7%94%a6/
2016/9/6, G20峰會達5大共識 重金融治理提高全球經濟抗風險能力 ,二十國集團(G20)領導人杭州峰會於昨(5)日閉幕，大陸國家主席習近平表示，此次會議就加強政策協調及影響世界經濟等問題，深入交換看法，並達成五大重要共識，包括要為世界經濟指明方向，規劃路徑；創新增長方式，為世界經濟注入新動力；完善全球經濟金融治理，提高世界經濟抗風險能力；重振國際貿易和投資兩大引擎的作用，構建開放型世界經濟；以及推動包容和聯動式發展，讓二十國集團合作成果惠及全球。對於此次峰會達成的共識和取得的主要成果，習近平指出，當前世界經濟增長仍然乏力，增長動力不足，國際和地區熱點問題及全球性挑戰對世界經濟的影響不容忽視；要繼續加強宏觀政策溝通和協調，凝聚共識，促進世界經濟強勁、可持續、平衡、包容增長；《二十國集團領導人杭州峰會公報》進一步明確了二十國集團合作的發展方向、目標、舉措，就推動世界經濟增長達成了杭州共識，為構建創新、活力、聯動、包容的世界經濟描繪了願景。他進一步指出，面對當前世界經濟風險和挑戰，需要標本兼治，綜合施策，運用好財政、貨幣、結構性改革等多種有效政策工具，既要做好短期風險防範和應對，也要挖掘中長期增長潛力；既要保持總需求力道，也要改善供給品質，這將向國際社會傳遞二十國集團成員共促全球經濟增長的積極信號，有助於提振市場信心，維護全球金融市場穩定。在本次峰會中，G20也同意充分發揮貿易部長會和貿易投資工作組的作用；共同制定《二十國集團全球貿易增長戰略》，促進包容協調的全球價值鏈發展，繼續支持多邊貿易體制，重申反對保護主義承諾，以釋放全球經貿合作潛力，扭轉全球貿易增長下滑趨勢；同時亦制定了《二十國集團全球投資指導原則》，這是全球首個多邊投資規則框架，可說是填補了國際投資領域空白。MoneyDJ 新聞 2016-09-06 09:43:12 記者新聞中心 報導,https://blog.moneydj.com/news/2016/09/06/g20%e5%b3%b0%e6%9c%83%e9%81%945%e5%a4%a7%e5%85%b1%e8%ad%98-%e9%87%8d%e9%87%91%e8%9e%8d%e6%b2%bb%e7%90%86%e6%8f%90%e9%ab%98%e5%85%a8%e7%90%83%e7%b6%93%e6%bf%9f%e6%8a%97%e9%a2%a8%e9%9a%aa%e8%83%bd/
2016/9/6, 價量齊揚 巴西鐵礦石出口量與出口額雙雙增長 ,"普氏能源資訊報導，巴西發展、工業暨貿易部（MDIC）9月2日公佈的數據顯示，2016年8月，巴西鐵礦石出口量為3,450萬噸，較去年同期的2,712萬噸增加27.2%。鐵礦石出口額則是較去年同期的9.7億美元增加29.3%至12.5億美元，主要是因為鐵礦石價格較去年同期的每噸35.81美元上揚至每噸36.40美元的影響。與前月3,025萬噸的出口量相比，8月份巴西鐵礦石出口量月增14.1%，鐵礦石出口額則是月增26%。巴西是第二大的鐵礦石出口國，僅次於澳洲。 作為巴西最重要的出口農產品，8月份巴西黃豆出口量為381.6萬噸，較前月以及去年同期分別減少了34%與26%。此外，8月份巴西粗糖出口量223萬噸，較前月下滑9%，但較去年同期增長60%；精糖出口量73.6萬噸，較前月增加51%，較去年同期則大增120%。巴西是最大的黃豆與糖出口國。 分析公司福四通（INTL FCStone Inc.）報告表示，在聖嬰現象（El Nino）之後可能出現的反聖嬰現象（La Nina），或會對巴西的作物生產造成一些影響。福四通報告指出，對黃豆與玉米等在乾季生長的作物來說，反聖嬰現象所造成的威脅通常更大，巴西南部的黃豆單產可能因此出現下滑，因該區黃豆的主要生長季節是在南半球的夏季。而雖然預期到2017年初的時候，反聖嬰現象的影響仍可望較為輕微，但其對巴西冬季玉米的威脅則是較難預測。 聯合國糧農組織（FAO）報告則指出，FAO食糖價格指數7月份上漲2.2%，主要因為巴西貨幣在7月份對美元匯率走強。巴西幣升值限制了巴西食糖向世界市場的出口，因為生產者更願意將甘蔗加工成乙醇在當地市場上出售，因此對國際食糖價格提供了支持。 國際糖業組織（International Sugar Organisation, ISO）報告表示，2016/17年度，全球糖產量預估將年增217萬噸至1.68億噸，但產量增長的速度趕不上需求的增速，2016/17年度糖市消費量預估將年增350萬噸至1.75億噸，這也將令糖市的期末庫存降至7,500萬噸以下。ISO表示，兩大糖產國巴西與印度的產量都預期將會下滑，其中巴西產量預估將年減125萬噸至3,650萬噸，印度糖產量則可能創下多年新低至2,450萬噸，但歐盟糖產量預估將年增140萬噸至1,565萬噸，而包括澳洲、中國大陸以及俄羅斯等的糖產量也可望增長。（更多巴西商品出口圖表） MoneyDJ 新聞 2016-09-06 15:32:52 記者黃文章 報導",https://blog.moneydj.com/news/2016/09/06/%e5%83%b9%e9%87%8f%e9%bd%8a%e6%8f%9a-%e5%b7%b4%e8%a5%bf%e9%90%b5%e7%a4%a6%e7%9f%b3%e5%87%ba%e5%8f%a3%e9%87%8f%e8%88%87%e5%87%ba%e5%8f%a3%e9%a1%8d%e9%9b%99%e9%9b%99%e5%a2%9e%e9%95%b7/
2016/9/2, 杭州G20領導人峰會9/4登場 首度探討綠色金融議題 ,"中證網報導，2016年二十國集團(G20)領導人峰會即將於9月4日至5日在大陸杭州舉辦。中國代表團於昨(1)日舉行新聞發佈會，人民銀行副行長易綱表示，今年G20將首次討論綠色金融議題，已成立了綠色金融研究小組，且目前更已做出《G20綠色金融綜合報告》，明確了綠色金融定義、目的和範圍以及面臨的挑戰，並為各國發展綠色金融獻計獻策，繼續支持全球經濟向綠色低碳轉型。據大陸銀監會政策研究局巡視員葉燕斐表示，截至今年6月底，大陸21家主要銀行機構綠色信貸餘額達到7.26兆元(人民幣,下同)，占各項貸款的9%。其中節能環保、新能源、新能源汽車等戰略性新興產業貸款餘額1.69兆元，節能環保專案和服務貸款餘額為5.57兆元。MoneyDJ 新聞 2016-09-02 13:03:24 記者新聞中心 報導",https://blog.moneydj.com/news/2016/09/02/%e6%9d%ad%e5%b7%9eg20%e9%a0%98%e5%b0%8e%e4%ba%ba%e5%b3%b0%e6%9c%8394%e7%99%bb%e5%a0%b4-%e9%a6%96%e5%ba%a6%e6%8e%a2%e8%a8%8e%e7%b6%a0%e8%89%b2%e9%87%91%e8%9e%8d%e8%ad%b0%e9%a1%8c/
2016/8/25, G20經濟熱點分析報告：全球經濟下行風險仍存在 ,中證網報導，由經濟科學出版社出版的《二十國集團(G20)經濟熱點分析報告(2016-2017)》於今(25)日發佈。報告指出，2015-2016年，G20經濟運行呈現出幾個特點，一是全球經濟增長動力不足，G20經濟表現分歧明顯；二是新興經濟體仍是世界經濟發展的重要力量，全球經濟格局重構加速；三是G20結構性問題依然突出，深化結構性改革已成為共識；四是自由貿易仍然是推動經濟發展的核心動力，但國際貿易環境嚴峻；五是投資和建設基礎設施是驅動世界經濟復甦和可持續增長的重要引擎；六是科技創新是推進各國經濟復甦增長的重要動能。報告分析指出，2015-2016年，G20各成員間的經濟成長表現出較大的分歧，增長動力仍較疲軟，經濟成長動力不足，儘管G20各成員都採取了一定的經濟擴張政策，實行了貨幣寬鬆政策、加大財政刺激，但有效需求不足等問題始終未能解決，同時還帶來了債務高檔、結構失衡和產能過剩等問題，全球經濟下行風險持續存在，並突出表現為大宗商品價格波動，許多經濟體出現低通膨等。國際貿易增長緩慢，報告指出，國際貿易大環境日趨嚴峻，全球範圍內的產業轉移放緩、投資和貿易不振、匯率震盪扭曲貿易成本、貿易保護主義抬頭等因素致使國際貿易增速大幅趨緩。國際貿易增速在2011-2015年已連續四年低於3%。雖然今(2016)年4月世界貿易組織(WTO)預測全年度的全球貨物貿易增速將達到4%，但前景仍不容樂觀。同時，貨幣政策持續寬鬆，報告指出，2008年金融危機發生後，世界各國紛紛採取寬鬆的貨幣政策。當前G20各成員貨幣政策的主要目標仍在於繼續支援經濟增長和保持價格穩定，並沒有大幅改變貨幣政策態勢的意圖，且在當前全球經濟復甦乏力、增長疲軟、貿易形勢嚴峻的背景下，G20進一步擴大貨幣寬鬆的可能性還會進一步提高。此外，結構性問題依然突出，報告指出，為因應國際金融危機，G20各成員相繼推出一系列經濟刺激計畫，這對維持經濟增長或實現經濟復甦發揮了一定作用，但效果並不持久。報告認為，很多國家的深層次、結構性問題依然未得到有效解決，結構性改革進展依然緩慢。報告中建議，G20各國今後應加快結構改革和轉型，加大科技創新，突出「包容性」和「非對抗性」的特徵，擴大和深化務實合作，積極推動貿易自由化和便利化，抑制貿易保護主義，持續加大基礎設施建設投資，有效推動經濟穩定增長。MoneyDJ 新聞 2016-08-25 15:38:43 記者新聞中心 報導,https://blog.moneydj.com/news/2016/08/25/g20%e7%b6%93%e6%bf%9f%e7%86%b1%e9%bb%9e%e5%88%86%e6%9e%90%e5%a0%b1%e5%91%8a%ef%bc%9a%e5%85%a8%e7%90%83%e7%b6%93%e6%bf%9f%e4%b8%8b%e8%a1%8c%e9%a2%a8%e9%9a%aa%e4%bb%8d%e5%ad%98%e5%9c%a8/
2016/8/12, IEA：低油價帶動需求增長 看好巴西產油增加 ,"國際能源署（IEA）8月11日在月報當中表示，受到供應仍然過剩以及需求成長疲弱的影響，近期原油價格遭受一些壓力。IEA預估，2016年全球石油需求成長將為每日140萬桶，2017年的增幅則將放緩至每日120萬桶，需求增長主要是受到低油價的帶動；其中，今年的需求成長預估與前月相同維持不變，2017年的需求增幅則是較前月預估下調了每日10萬桶，主要因為英國脫歐、大陸經濟轉型，以及資源出口國經濟前景展望較弱等的影響。 7月份，全球石油供應量增加約每日80萬桶，包括石油輸出國組織（OPEC）以及非OPEC國家的產油均有增長，但與去年同期相比則仍減少每日21.5萬桶，主要受到非OPEC國家產量下滑的影響，OPEC產量則是年增每日84萬桶。IEA預估，今年非OPEC國家的原油日產量將年減90萬桶，但2017年預期將年增30萬桶，主要將是受到哈薩克卡沙干（Kashagan）油田投產的帶動。 IEA表示，7月份OPEC原油日產量增加15萬桶至3,339萬桶，因沙烏地阿拉伯產量創下新高，伊拉克產量也呈現增長的影響。在中東國家原油產量增長的帶動下，OPEC原油日供應量年增68萬桶，並創下8年以來的新高。OPEC發佈的最新數據則是顯示，沙烏地阿拉伯7月份的石油日產量拉升至接近1,100萬桶、刷新歷史高點，使得7月整體OPEC原油日產量月增了46,000桶、來到3,311萬桶。 IEA也看好巴西的原油產量將重現增長，稱即使在經濟以及政治危機之下，該國7月份的產量已經達到創新高的每日256萬桶，而挪威國油（Statoil）近期從巴西國油取得卡卡拉（Carcara）深海鹽下層油田的66%權益，也顯示巴西國油對該國富含石油的深海鹽下層資源的控制減少，有利於爭取國際石油公司的投資。 MoneyDJ 新聞 2016-08-12 11:12:26 記者黃文章 報導",https://blog.moneydj.com/news/2016/08/12/iea%ef%bc%9a%e4%bd%8e%e6%b2%b9%e5%83%b9%e5%b8%b6%e5%8b%95%e9%9c%80%e6%b1%82%e5%a2%9e%e9%95%b7-%e7%9c%8b%e5%a5%bd%e5%b7%b4%e8%a5%bf%e7%94%a2%e6%b2%b9%e5%a2%9e%e5%8a%a0/
2016/8/11, 巴西能續漲？哈森泰博、貝萊德Richardson謹慎看旺 ,巴西里約舉辦的第31屆奧運吸引全球目光，巴西股市也成為今(2016)年表現最優秀的市場之一，但漲勢能否延續下去？全球最大資產管理集團貝萊德(BlackRock Inc.)美國iShares投資策略長Heidi Richardson認為，巴西股市仍有續漲的潛力，前提是投資人得願意承受高度的風險。Richardson 10日在官方部落格上指出，雖然巴西近來利空消息頻傳，從總統遭彈劾到會使孕婦生下小頭症嬰兒的茲卡(Zika)病毒，都令人膽戰心驚。然而，據統計，MSCI巴西25/50指數(MSCI Brazil 25/50 Index)年初迄今已跳漲逾50%，MSCI巴西小型股指數(MSCI Brazil Small Cap Index)也大漲逾60%，表現在全球可說是名列前茅。Richardson表示，巴西經濟在連續兩年嚴重衰退後，最近出現觸底跡象，工業生產已開始翻揚，企業信心也帶頭轉強。不只如此，當地物價從今年年初就逐漸趨緩，新上任的央行委員會集中火力打壓通膨，也使未來一年的通膨預期降低。這些變化讓愈來愈多人預期央行將放寬貨幣政策，有機會在第4季宣布降息，支撐經濟復甦。不過，巴西整個體質仍脆弱，經濟依舊失衡，諸如財政疲弱、債務沉重與失業率高漲等問題仍待解決，而經濟改革措施相當複雜，許多還相當不受大眾歡迎，巴西政府面臨了極大挑戰。在總統羅賽芙(Dilma Rousseff)下台接受彈劾審判後，副總統Michel Temer 5月上台暫代總統職務，他所指派的內閣成員頗受投資人和政治圈青睞，也強化了內閣跟國會的關係，有助於通過經濟改革法案。若參議院能通過羅賽芙的彈劾案，那麼改革有望加速進行，但投資人仍得慎防彈劾案未過關所引發的風險。除此之外，投資人認為情勢將向最好的狀況演變，已讓巴西股市在今年大漲，倘若市場期望落空，那麼股市有可能會大幅修正，大家絕不能掉以輕心。富蘭克林坦伯頓全球宏觀團隊投資長、「富蘭克林坦伯頓全球債券基金」(Templeton Global Bond Fund)操盤人麥可哈森泰博(Michael Hasenstab)早在今(2016)年2月就看好巴西，當時正好位於股市最低點附近。(見此)現在，哈森泰博9日又在官方部落格指出，巴西雖然脆弱、但卻即將反彈，巴西央行升息打擊通膨，終將降低通膨預期，財政政策也收緊，國際貨幣基金組織(IMF)更預測，未來幾年巴西財政有望逐步改善。值得注意的是，巴西的公共債務仍相對合理，即使近來有惡化跡象，但整體公共債務佔GDP的比例仍只略高於70%，淨債務對GDP佔比更低於40%，給予政府喘息的空間。在政府的努力下，巴西負債的上升速度趨緩，今年的債務年增率僅約20%，遠低於之前數年的60%。哈森泰博認為，只要度過當前的政治危機、新政府站穩腳步，巴西就能達成市場的期望。巴西已經從之前的危機學到教訓，對外匯波動、外匯存底以及國家債務都有全新理解，中產階級更強烈表達意願，希望政府運作更加透明、經濟進行改革以拉高生活水準。這些都將化為強烈動力，敦促巴西政府推動結構性改革，例如改善企業經營環境等。 ＊編者按：本文僅供參考之用，並不構成要約、招攬或邀請、誘使、任何不論種類或形式之申述或訂立任何建議及推薦，讀者務請運用個人獨立思考能力，自行作出投資決定，如因相關建議招致損失，概與《精實財經媒體》、編者及作者無涉。MoneyDJ 新聞 2016-08-11 12:17:50 記者郭妍希 報導,https://blog.moneydj.com/news/2016/08/11/%e5%b7%b4%e8%a5%bf%e8%83%bd%e7%ba%8c%e6%bc%b2%ef%bc%9f%e5%93%88%e6%a3%ae%e6%b3%b0%e5%8d%9a%e3%80%81%e8%b2%9d%e8%90%8a%e5%be%b7richardson%e8%ac%b9%e6%85%8e%e7%9c%8b%e6%97%ba/
2016/8/8, 奧運為利多、上漲機率過半，美股續破新高在望？ ,"美國就業數據亮眼，標普500指數改寫空前新高，分析師發現，美股還有希望續漲。研究顯示，奧運賽事時期，美股通常都會上漲。MarketWatch、Business Insider報導，巴西里約奧運5日開幕，賽事為期兩週。Bespoke Investment Group回顧1928年以來的20次奧運，發現標普500指數在奧運開幕到閉幕期間，平均攀升1.75%，中位數(median)平均走高0.30%，上漲機率達55%。FactSet分析顯示，道瓊工業指數在奧運期間也表現出色，平均走高3.9%。各類股而言，CMC Markets首席市場分析師Colin Cieszynski指出，成衣和飲料股報酬最好，分別上揚2.8%、2%。另外，高盛預估，今年美國隊將奪下106面獎牌，可能會成為奧運最大贏家，有利股市情緒。從技術分析來看，美股短期動能好轉，指數或許會脫離盤整。Instinet LLC執行董事Frank Cappelleri表示，將近一個月來，儘管買氣未見爆發，標普500仍維持在上行軌道，只要能守住2,120點的突破缺口，有望上看2,235點。此外，對奧運主辦國來說，奧運期間股市也是上漲居多。Bespoke稱，1984以來，奧運東道國股市平均走高1.74%(中間數為2.32%)。過去8次賽事，有6次上漲，股市攀揚機率為75%。MoneyDJ新聞報導，道瓊工業平均指數8月5日終場上漲1.04%、收18,543.53點，創7月22日以來收盤新高。那斯達克指數上漲1.06%、收5,221.12點，創下歷史收盤新高。標準普爾500指數上漲0.86%、收2,182.87點，創下歷史收盤新高。美國勞工部5日公布的數據顯示，7月非農業就業人數新增了255,000人，遠超乎經濟學家原先預估的180,000人，6月的新增就業人數也略為上修至292,000人。即使勞動參與率增加至62.8%，但失業率卻依舊持平於4.9%，顯示就業市場已開始吃緊。平均時薪的月增幅更達0.3%、優於6月的0.1%，並創4月以來新高，意味著薪資有加快上升的跡象。＊編者按：本文僅供參考之用，並不構成要約、招攬或邀請、誘使、任何不論種類或形式之申述或訂立任何建議及推薦，讀者務請運用個人獨立思考能力，自行作出投資決定，如因相關建議招致損失，概與《精實財經媒體》、編者及作者無涉。MoneyDJ 新聞 2016-08-08 08:13:18 記者陳苓 報導",https://blog.moneydj.com/news/2016/08/08/%e5%a5%a7%e9%81%8b%e7%82%ba%e5%88%a9%e5%a4%9a%e3%80%81%e4%b8%8a%e6%bc%b2%e6%a9%9f%e7%8e%87%e9%81%8e%e5%8d%8a%ef%bc%8c%e7%be%8e%e8%82%a1%e7%ba%8c%e7%a0%b4%e6%96%b0%e9%ab%98%e5%9c%a8%e6%9c%9b%ef%bc%9f/
