Time,Title,Content,Url
2015/9/6, 2015/08 月份 FundDJ 網友點閱率 資金流向 及收益排行(2015/8/5~2015/9/6) ,"2015/08 月份 全球基金排行FundDJ 在 “MoneyDJ iQuote /基金總覽” 功能中，隨時統計台灣銷售的全球基金績效，我們可以透過這些統計資料追蹤全球市場的漲跌趨勢。以下是 2015/08 月份的報酬排行，觀察這些資料我們可以簡單得到以下結果:8月份全球股災，表現較好的基金是反向及放空基金，ProShare 二倍放空S&P 報酬有15.62% 為第一名。其他第二名至第六名也都是放空型基金。如 富邦上正反向基金、元大寶來滬深300反向基金及ProShare放空 S&P、 DowJone、 Nasdaq 基金。8 月分台股下跌後，國安基金進場及看好證所稅修正，股市反彈表現比全球其他市場強勁，所以國內基金如 台新高股息、台新台灣中小、摩根中小、保德信中小、保德信店頭績效表現亮眼。表現比較不好的基金都是跟中國有關的基金，尤其是投資中國小型股非『中國國家隊』救市標的股票的基金，加上8月份人民幣放手貶值。所以績效非常不好，下跌2~3成。群益中國、群益大中華績效最差，分居前三名。跌幅將近3成。除根中國相關基金，巴西里搭大幅貶值將近一成，加上股市跌幅跟其他市場差不多(約 -10%)，造成巴西相關基金表現極差，跌幅將進兩成。資料來源:MoneyDJ iQuote /基金總覽2015/08 月份 世界財經指數排行FundDJ 在 “MoneyDJ/iQuote /市場動態” 功能中，隨時統計世界個市場指數及相關產業代表性指標，我們可以透過這些統計資料追蹤全球市場的漲跌趨勢。以下是 2015/08 月份的報酬排行，觀察這些資料我們可以簡單得到以下結果:8月份下旬陸股在美股道瓊大跌超過500點的影響下，暴跌超過8%做收，中國人行在25日緊急宣布?降，要降息降準來救股市，不過由於大陸政府這猛藥，今年已經用了6次，投資人失去抗藥性，26號陸股繼續往下探，直到3000點左右止跌。綜觀8月整個月，上證指數從4000點左右跌到3000點，下跌約兩成五，然後於8月底反彈至3200點。所以8月份跌幅較高的指數都是跟中國有關的指數，其中深圳A股、上海B股跌幅約兩成，香港國企跌幅也有-17.2%。馬來西亞股匯雙跌，股市跌幅-18.79%，為跌幅第三名。全球股災造成資金從新興市場移出，新加坡跌幅-13.85%為跌幅第八名。日幣變成全球資金避風港，一度從125圓升值至116圓。日圓升值造成日本股市大跌，8月份日經指數下跌13.3為跌幅第13名，東證一部下跌-12.97%為跌幅第14名。除了中國、新興市場、日本外，歐洲及生技股票也跌幅頗深。主要是股市回檔，投資人停利生技相關股票所致。全球股災，避險資金進入黃金，AMEX 金蟲 CBOE 黃金上漲1.26，為表現最好第四名、第五名。8月份油價的反彈，布蘭原油期貨一度站回到50塊美元一桶，紐約西德州原油期貨也回到40塊以上，與石油相關指數表現相對其他市場不錯。費城油業表現持平(上漲0.6%)為第十名。新興市場股市表現普遍不佳。資料來源:MoneyDJ iQuote /市場動態2015/08 月份 海外基金點閱率排行FundDJ 在 “MoneyDJ 基金/基金排名/海外基金-人氣排行” 功能中，統計網友對於各海外基金的點閱率，透過點閱率排行我們可以觀察網友有興趣的基金，進而歸納FundDJ網友的投資趨勢。以下是 2015/08 月份的海外基金點閱排行，觀察這些資料我們歸納如下:摩根俄羅斯基金躍居網友最常點閱的基金第一名。主要是FundDJ 討論區，有網友關注短期搶短。加上上個月石油一度反彈將近三成(28%)，摩根俄羅斯基金8月底也強勁反彈。貝萊德新能源基金A2躍居網友最常點閱的基金第二名，貝萊德新能源是投資新能源的全球型基金，上個月績效表現不佳，上個月績效-10%。聯博高收益債券雖然受到升息預期引響，但是遇到全球股災，網友尋求避險相關基金點閱率，上升至第三名。貝萊德世礦績效大幅滑落(上個月績效 -8.33%)，推測是礦產相關股票持續探底。由原先第一名滑落至第五名。推測是網友停損造成持有網友減少。德盛安聯收益成長基金點閱率依然不錯，績效表現平穩為第四名。德盛安聯收益成長基金以三分之一可轉換債、三分之一高收益債，及三分之一的成長股搭配選擇權。績效表現平穩，成為網友最新關注的基金。富蘭克林生技領航8月份高檔震盪後回落跌幅有-10.94%，依然是網友喜歡點閱的基金，有停利的壓力。摩根東協、印度點閱率維持高檔，是第九、十名。其中印度相關基金雖然國際股市波動，表現依然亮眼。資料來源:MoneyDJ 基金/基金排名/海外基金-人氣排行2015/08 月份 國內基金點閱率排行FundDJ 在 “MoneyDJ 基金/基金排名/國內基金-人氣排行” 功能中，統計網友對於各國內基金的點閱率，透過點閱率排行我們可以觀察網友有興趣的基金，進而歸納FundDJ網友的投資趨勢。以下是 2015/08 月份的國內基金點閱排行，觀察這些資料我們歸納如下:統一強漢基金異軍突起，從七月份開始點閱率躍居第一名。統一強漢基金主要投資於中國、香港、台灣、東南亞的區域基金。是國內基金定期定額前十大標的。(根據投信投顧公會統計資料，定期定額前十大標的中，統一大滿貫、國泰中小成長、國泰小龍、群益馬拉松、保德信高成長等都是屬於台股基金，另外，統一強漢、群益中國新機會、國泰中國新興戰略則屬於大中華基金，只有摩根亞股和保德信全球醫療生化是屬於非台股、大中華基金) 八月份績效不佳-9.53%。國內基金跟中國有關的基金上個月點閱率依然很高，群益中國新機會，第二名。2015/˙7月進入前十二名的中國基金除了摩根中國A股外。還有摩根中國A股、富蘭克林中國A股、元大大中華、匯豐中國A股、保德信中國、富蘭克林中國消費基金等五檔，佔了排行榜將近一半。2015/˙8月只剩摩根中國A股、富蘭克林中國A股、元大大中華還在榜內。推測原因為中國股市劇跌，網友停損所致。柏瑞全球高收益依然是熱門點閱率基金，表現良好為第四名。德盛生技大壩點及德盛全球綠能閱率依然不錯，分別為第三、七名。資料來源:MoneyDJ 基金/基金排名/國內基金-人氣排行2015/08 月份 ETF股數創造排行(統計日期: 08/03/2015 – 09/03/2015 )過去許多投資人都習慣、也只能從ETF的規模來判斷資金的進出，但這個資訊其實雜訊很多，也是相當間接的證據。一檔ETF的規模增加，會有兩個影響因素，一個是股價上漲，一個是股數增加，而後者才能真正看出資金的流入。FundDJ 在 “MoneyDJ ETF/ ETF排行 / 交易排行 / 股數創造排行” 功能中提供了一個新的排行榜，讓投資人可以從這個排行榜去追蹤不同時間區間下股數變化的情況，無論是單日、一個月、一季或一年都可以。透過股數創造排行我們可以觀察ETF的基金流入排行，進而掌握全球的資金流入趨勢。由於ETF的資訊我們每天計算及追蹤，在世界金融機構每季發佈資金流向前，我們可以提早掌握趨勢。本次接露資訊不是以創造股數來統計，而是以創造金額還加以排行，更能忠實反映全球資金流向。以下是 2015/08 月份的ETF股數創造排行，觀察這些資料我們歸納如下(我們加上紅色框框表示要網友注意的地方):標普500指數ETF，資金流入第一名。Vanguard標普500指數也居第二名。表示資金因為全球動盪，已經回流美國市場避險，並停駐在長期安全的大型及藍籌股上。雖然市場預期聯準會升息，美國債券避險資金大幅流入，尤其是短期公債ETF，1-3年期美國公債、短期美國公債、1-3月美國國庫券分居第三、四、六名。長期公債也有大幅避險資金流入7-10年期美國公債、20年期以上美國公債分居第五、七名。放空型ETF，VelocityShares每日放空短期波動率指數主要是放空S&P 500 VIX Short-Term Futures Index，位居資金流入第八名。相關避險ETF如 歐澳遠東匯率避險股票 位居資金流入第九名，顯示資金流向避險標的。iShares MSCI美國最小波動率ETF。追蹤之指數為MSCI USA Minimum Volatility Index，位居資金流入第十名。TickerETF 名稱創造金額 *SPYSPDR標普500指數ETF4,755.09VOOVanguard標普500指數ETF2,100.14SHYiShares 1-3年期美國公債ETF1,560.02SHViShares短期美國公債ETF1,510.69IEFiShares 7-10年期美國公債ETF1,407.46BILSPDR巴克萊1-3月美國國庫券ETF1,370.95TLTiShares 20年期以上美國公債ETF1,316.35XIVVelocityShares每日放空短期波動率指數ETN1,137.84DBEFDeutsche X-trackers MSCI歐澳遠東匯率避險股票ETF1,092.00USMViShares MSCI美國最小波動率ETF840.33* 創造金額單位美金百萬元2015/08 月份 ETF股數贖回排行過去許多投資人都習慣、也只能從ETF的規模來判斷資金的進出，但這個資訊其實雜訊很多，也是相當間接的證據。一檔ETF的規模增加，會有兩個影響因素，一個是股價上漲，一個是股數增加，而後者才能真正看出資金的流入。FundDJ 在 “MoneyDJ ETF/ ETF排行 / 交易排行 / 股數創造排行” 功能中提供了一個新的排行榜，讓投資人可以從這個排行榜去追蹤不同時間區間下股數變化的情況，無論是單日、一個月、一季或一年都可以。透過股數贖回排行我們可以觀察ETF的基金贖回排行，進而掌握全球的資金流出趨勢。由於ETF的資訊我們每天計算及追蹤，在世界金融機構每季發佈資金流向前，我們可以提早掌握趨勢。本次接露資訊不是以贖回股數來統計，而是以贖回金額還加以排行，更能忠實反映全球資金流向。以下是 2015/08 月份的ETF股數贖回排行，觀察這些資料我們歸納如下(我們加上紅色表示要網友注意的地方):資金流出第一、二名Vanguard FTSE新興市場ETF及iShares MSCI新興市場ETF，顯示全球股災。資金流出新興市場流回美國，新興市場美元債券ETF資金也大幅流出，也在第六名。資金流出第三名為生技相關ETF，SPDR健康照護類股ETF，全球股災，生技相關股票高本益比修正，資金流出。iShares納斯達克生技ETF也在資金流出第十名。科技相關ETF資金也逢高停利流出。中國ETF 上個月資金流出甚多，本月沒有進榜。TickerETF 名稱贖回金額 *VWOVanguard FTSE新興市場ETF-2,472.00EEMiShares MSCI新興市場ETF-1,377.30XLVSPDR健康照護類股ETF-990.36RSPGuggenheim標普500平均加權指數ETF-976.59XLKSPDR科技類股ETF-915.96EMBiShares J.P. Morgan新興市場美元債券ETF-875.78XLFSPDR金融類股ETF-857.72XLYSPDR非必需消費類股ETF-805.20QQQPowerShares納斯達克100指數ETF-714.47IBBiShares納斯達克生技ETF-664.81* 贖回金額單位美金百萬元歡迎大家引用轉載 轉載時請加上資料來源網址…",https://blog.moneydj.com/news/2015/09/06/201508-%e6%9c%88%e4%bb%bd-funddj-%e7%b6%b2%e5%8f%8b%e9%bb%9e%e9%96%b1%e7%8e%87-%e8%b3%87%e9%87%91%e6%b5%81%e5%90%91-%e5%8f%8a%e6%94%b6%e7%9b%8a%e6%8e%92%e8%a1%8c201585201596/
2015/9/3, 巴西經濟一攤死水、央行不敢妄動！利率終止連七升 ,MoneyDJ新聞 2015-09-03 10:21:27 記者 郭妍希 報導巴西深陷衰退深淵、消費需求萎縮終於讓居高不下的通膨預期趨緩，眼見經濟已呈一攤死水，巴西央行終於趁通膨預期降溫之際趕忙停下升息腳步。彭博社、路透社報導，巴西中央銀行貨幣委員會(Copom)2日一致通過將基準利率(Selic rate)維持在九年高點14.25%不變，但仍居全球前十大經濟體之冠。根據彭博社調查，56名受訪的經濟學家中，有51名預測到這個結果。巴西央行最新的貨幣政策聲明並未做出任何改變，意味著央行接下來應該都會按兵不動、靜待通膨下降。巴西之前為了壓抑不斷飆漲的通膨，曾連續七度升息、升幅總計高達3.25個百分點。巴西的消費者、企業信心目前都已滑落至歷史低點，而隨著里拉匯價重貶、政治危機爆發，經濟前景也更加不樂觀。央行調查的經濟學家都悲觀認為，巴西今(2015)年與明年會接連出現衰退、為1931年以來首度有經濟連續兩年萎縮的情況。Banco Safra首席經濟學家Carlos Kawall表示，巴西經濟嚴重趨緩，影響程度已超越貨幣走弱、財政赤字改革失敗所引發的通膨風險。雖然巴西財政部長Joaquim Levy承諾要改善財政赤字，但情況仍持續惡化，讓央行幾乎找不到後援來壓抑通膨。巴西在今年第2季正式進入衰退期，國內生產毛額(GDP)季減率達到1.9%；7月工業生產也月減1.5%、遜於經濟學家預估。里拉相對於美元年初迄今則已重貶29%，貶幅居彭博社追蹤的16大貨幣之冠。＊編者按：本文僅供參考之用，並不構成要約、招攬或邀請、誘使、任何不論種類或形式之申述或訂立任何建議及推薦，讀者務請運用個人獨立思考能力，自行作出投資決定，如因相關建議招致損失，概與《精實財經媒體》、編者及作者無涉。全文網址: http://www.moneydj.com/KMDJ/News/NewsViewer.aspx?a=7302f053-832b-4618-8431-b6ae0d0b9a5d&c=MB110000#ixzz3kekjIK00 MoneyDJ 財經知識庫,https://blog.moneydj.com/news/2015/09/03/%e5%b7%b4%e8%a5%bf%e7%b6%93%e6%bf%9f%e4%b8%80%e6%94%a4%e6%ad%bb%e6%b0%b4%e3%80%81%e5%a4%ae%e8%a1%8c%e4%b8%8d%e6%95%a2%e5%a6%84%e5%8b%95%ef%bc%81%e5%88%a9%e7%8e%87%e7%b5%82%e6%ad%a2%e9%80%a3%e4%b8%83/
2015/9/3, 金磚掉漆！經濟衰退與貪腐雙重風暴，穆迪調降巴西信評 ,(新聞來源: 科技新報)作者 陳 思宇昔日被譽為金磚四國（BRICs）的巴西，最近深陷經濟衰退與政治醜聞的雙重風暴：財政官員坦承 2015 年經濟復甦承諾跳票，世界銀行更預估 2015 年巴西 GDP 為負成長；而 2015 年初開始調查的國營石油公司貪腐案，竟然像滾雪球一樣越滾越大、牽扯的官員層級越來越高，甚至連巴西總統羅賽芙（Dilma Rousseff）都涉嫌收賄。穆迪（Moody’s）、標普與惠譽國際（FitchRatings）紛紛降低巴西的信評等級，究竟過去備受分析師看好的巴西，怎麼變成今日的局面呢？巴西正面臨 25 年來最嚴重的經濟衰退，世界銀行更是估計 2015 年巴西 GDP 成長率為 -1% 。 1 日巴西官員首度承認 2015 年巴西經濟成長停滯、先前承諾的經濟復甦至少要等到 2017 年，使走勢疲軟的巴西幣里拉（real）再度走貶， 2 日收在1 巴西里拉兌 0.27 美元，創 12 年新低。2015 年至今巴西幣里拉兌美元貶值幅度已超過 25% 。到底曾經好幾年 GDP 年增率高達 6% 、高盛首席分析師都看好的巴西經濟怎麼了？《CNN Money》總結近日巴西經濟一團亂的主要原因：中國經濟成長碰壁、原物料價格走跌，以及國營石油公司 Petrobras貪污弊案重擊外資信心。▲ 巴西與金磚四國 2011 年至 2017 年（預估值）的 GDP 成長率，2015 年 GDP 成長率為負 1% （source：World Bank）中國打噴嚏，巴西重感冒中國製造業、建設公司對鐵礦的需求，十年內讓每噸鐵礦石的價格漲了將近七倍，2015 年製造業火車頭中國經濟成長減速，可是害慘了靠出口原物料——尤其是鐵礦石維持經濟成長的巴西。例如巴西最大的鐵礦石供應商淡水河谷公司（Vale SA），由於最大的客戶中國對鐵礦的需求疲軟， Vale SA 2015 年第二季營收與去年同期相比重挫 29.7% 。過去十年來巴西靠著出口鐵礦等原物料大發利市，政府官員不停吹噓亮眼的經濟數據，還宣稱巴西會名列世界強國。當巴西主辦世足、爭取成為拉美第一個主辦奧運的國家，似乎讓人民相信巴西確實變好了，但現在經濟負成長、國內失業率與物價節節攀升，又爆出國營石油公司和政客掛鉤的貪腐醜聞，反差之大讓人民更無法忍受。國營石油公司貪污弊案除了經濟負成長，另一個使穆迪、標普紛紛降低巴西信評等級的原因是政治局勢混亂。 2015 年初巴西檢調單位調查國營石油公司 Petrobras 的弊案，因為巴西的貪污醜聞層出不窮，檢調人員早已見怪不怪。但沒想到 2015 年 6 月底情況急轉直下，汙點證人指證巴西總統羅賽芙與多名政府要員都曾收受賄賂，金額高達 20 億美金。這樁醜聞徹底點燃了巴西人民的怒火，雖然羅賽芙否認收賄，但超過八成巴西民眾相信總統知情且該負責， 8 月中超過 60 萬人走上街頭抗議政府腐敗與經濟不景氣、羅賽芙的支持率更是只剩個位數。信評機構穆迪（Moody’s）由於巴西政治局勢混亂、經濟陷入衰退，將巴西主權信評等級降至 Baa3，華爾街日報與彭博社毫不留情地指出，信評等級 Baa3 「只差一級就是完全不值得投資的垃圾了」。外資也紛紛出逃， 2015 年第二季投資額和去年同期相比下跌 12% 。How Brazil’s China-Driven Commodities Boom Went BustBrazil falls deep into recessionBrazilianRealFallsto12-YearLowasDeficitProjectedin2016（圖片來源：Flickr/AKRockefeller CC BY 2.0）,https://blog.moneydj.com/news/2015/09/03/%e9%87%91%e7%a3%9a%e6%8e%89%e6%bc%86%ef%bc%81%e7%b6%93%e6%bf%9f%e8%a1%b0%e9%80%80%e8%88%87%e8%b2%aa%e8%85%90%e9%9b%99%e9%87%8d%e9%a2%a8%e6%9a%b4%ef%bc%8c%e7%a9%86%e8%bf%aa%e8%aa%bf%e9%99%8d%e5%b7%b4/
2015/8/27, 新興市場企業「債」彈蠢動、230億美元將到期 , MoneyDJ新聞 2015-08-27 07:48:16 記者 陳苓 報導難怪垃圾債在8月份遭到拋售！原物料價格崩落16年新低，新興市場幣值暴跌，企業資金流動性左支右絀之際，如今又有230億美元的債務即將到期，讓業者更加焦頭爛額。彭博社27日報導，人民幣貶值引爆的賣壓，導致殖利率暴衝至近四年新高，企業要償付2016年底到期的美元計價債券更形困難。彭博數據顯示，新興市場企業中背負最多2016年到期的美元債務者，第一名是巴西石油公司(Petroleo Brasileiro SA)、第二是俄國天然氣巨擘Gazprom、第三是墨西哥電信商America Movil。Standard Life Investments信貸投資主管Samantha Lamb稱，如果業者有美元計價債務，卻沒有避險，資產負債表將承受壓力。若以國別而言，新興市場中，背負最多2016年到期企業債的國家是巴西，債務達81億美元。俄國排名第二，債務為68億美元。第三四名分別是墨西哥和印尼。巴西和俄國情況不佳，前者債信遭穆迪降評為投資等級的最低一級，後者則因國際制裁，難以取得新資金。與此同時，企業為避免負擔額外成本，減少發債，今年新債發行量大減21%、為2011年以來低點。Neuberger Berman新興市場債務團隊信貸分析師Manuel Guerena指出，部分企業將陷入泥淖。彭博社26日報導，由ETF指數基金的資金流向看來，投資人在八月份大買長天期公債、狂拋垃圾債。本週美國公債和垃圾債殖利率利差衝上650個基點，締造三年新高。股市和原物料接連崩盤，人們急忙出清風險資產，以免遭受虧損。彭博數據顯示，八月份失血最多的債券基金是iShares iBoxx $ High Yield Corporate Bond ETF(HYG)，最吸金的是iShares 20+ Year Treasury Bond ETF (TLT)。彭博社26日另一篇報導稱，Leader Capital Corp.債券基金經理人John Lekas，過去兩個月來，出售了1/4持有部位，他說他的演算模型出現售出訊號，他開始出脫部位，本想賣出更多，但因流動性不足未能如願。他認為，未來18個月利率升高和匯兌損失將加劇主權債風險。他說違約有兩種方式，一是像希臘、波多黎各等直接倒債，另一種是靠貨幣貶值，巨大風暴逐步進逼。Lekas掌理的債券基金，表現優於97%同業。＊編者按：本文僅供參考之用，並不構成要約、招攬或邀請、誘使、任何不論種類或形式之申述或訂立任何建議及推薦，讀者務請運用個人獨立思考能力，自行作出投資決定，如因相關建議招致損失，概與《精實財經媒體》、編者及作者無涉。全文網址: http://www.moneydj.com/KMDJ/News/NewsViewer.aspx?a=3ad8a06d-21b9-44e6-abd5-0837427cdce3&c=MB010000#ixzz3jyGk7kmp MoneyDJ 財經知識庫,https://blog.moneydj.com/news/2015/08/27/%e6%96%b0%e8%88%88%e5%b8%82%e5%a0%b4%e4%bc%81%e6%a5%ad%e3%80%8c%e5%82%b5%e3%80%8d%e5%bd%88%e8%a0%a2%e5%8b%95%e3%80%81230%e5%84%84%e7%be%8e%e5%85%83%e5%b0%87%e5%88%b0%e6%9c%9f/
2015/8/17, 台灣、南韓名列麻煩十國！大摩：陸企競爭力看升 ,MoneyDJ新聞 2015-08-17 08:39:59 記者 賴宏昌 報導忘了「脆弱五國(Fragile Five)」，現在該是認識「麻煩十國(Troubled Ten)」的時候！彭博社17日報導，摩根士丹利證券(大摩)全球外匯策略部主管Hans Redeker點名10個跟中國存在貿易競爭關係或與中國貿易往來密切的國家貨幣：巴西里拉、祕魯新索爾(Sol)、韓圜、南非幣、泰銖、新加坡幣、台幣、智利披索、哥倫比亞披索、俄羅斯盧布。Redeker直言，當前最大的挑戰就是全球經濟欲振乏力。日本、歐洲以及美國央行雖都已推出破紀錄的刺激政策，但國際貨幣基金組織(IMF)預估今年全球成長速度將創下2009年以來新低。彭博社統計顯示，2014年南非、南韓分別有37%、30%的外銷產品賣到中國。彭博社追蹤的主要新興市場貨幣上週下跌0.9%至歷史新低。Redeker認為中國經濟若要獲得提振、新興市場貨幣若想止貶，財政刺激規模必須夠大才行。他表示，目前最大的疑慮就是中國經濟表現將持續令投資人失望。SLJ Marco Partners LLP避險基金共同創辦人任永力日前即指出，人民幣的驟貶走勢恐將引爆新一回合的貨幣寬鬆浪潮，包括巴西里拉、印尼盾等新興市場貨幣在未來9個月內恐將貶值30-50%。瑞士信貸(Credit Suisse Group AG)預估開發中國家今年的經濟成長率僅達3.8%、創2009年以來新低。英國金融時報15日報導，未來資產管理集團(Mirae Asset Management)指出，中國分別佔南韓、台灣整體出口39%、29%的比重。Mirae預期，中期而言台灣、南韓的外銷業者(特別是電子企業)競爭力將輸給中國同業。大摩指出，中國當局若採取提升生產力的財政、貨幣寬鬆措施，中國企業的外銷競爭力可望因而提升，進而傷害到南韓、台灣廠商。大摩還提到，南韓、台灣、新加坡、泰國等面臨超低通膨的國家因受制於國內的高槓桿現象，迫使央行轉而透過貨幣貶值來打擊通縮威脅。嘉實XQ全球贏家系統報價顯示，美元兌俄羅斯幣上週週線漲1.45%、連續第8週走揚。美元兌人民幣11日大漲1.8%至6.3231、創1994年1月以來單日最大升幅。＊編者按：本文僅供參考之用，並不構成要約、招攬或邀請、誘使、任何不論種類或形式之申述或訂立任何建議及推薦，讀者務請運用個人獨立思考能力，自行作出投資決定，如因相關建議招致損失，概與《精實財經媒體》、編者及作者無涉。,https://blog.moneydj.com/news/2015/08/17/%e5%bf%98%e4%ba%86%e8%84%86%e5%bc%b1%e4%ba%94%e5%9c%8b%e5%90%a7%ef%bc%81%e6%91%a9%e6%a0%b9%e5%a3%ab%e4%b8%b9%e5%88%a9%e5%8f%88%e6%8f%90%e9%ba%bb%e7%85%a9%e5%8d%81%e5%9c%8b/
